304,44,“There's a pile of scattered trash: empty bottles， cans， and plastic bags.” “Some people must have had a party or something.” ,「あります・たくさんのまき散らされたゴミが／（具体的には）空の瓶・缶・そしてビニール袋」「何人かの人達がおこなったに違いない・パーティーか何かを」 ,「たくさんゴミが散乱しているよ。空き瓶に缶，それにビニール袋」「誰かがパーティーか何かをしたんだね，きっと」   
305,44,It seems that these outdated regulations have long hindered the progress of the distribution industry. We should have done away with them long ago. ,それが思われる／以下のことが・これらの時代遅れの規制が長い間妨げてきたと・進歩を／流通業界の。我々は廃止すべきだったのだ・それらを／ずっと昔に。 ,これらの時代遅れの規制が長い間流通業界の発展を妨げてきたように思えます。我々はとっくの昔にこれらを廃止すべきだったのです。   
306,44,Shortly afterward， Dave confided， “Between you and me， I didn't dare tell the truth for fear that I would be held responsible for it.” ,すぐに・後ほど／デーブは打ち明けた／「ここだけの話だが／私は勇気がなかった／話す・本当のことを／恐れて／次のことを・私がさせられると・責任をもつように／それに対し」 ,その後まもなくデーブはこう打ち明けた。「ここだけの話なんですが，あの時私は責任を取らされたらどうしようかと思って本当のことが話せなかったのです」   
307,44,Sid recalled， “Aside from all types of social oppression， we all had to contend with obstinate ignorance and prejudice.” ,シッドは思い起こした／「次の他にも・あらゆる種類の社会的な抑圧の／私達は皆闘わなければならなかった・頑固な無知と（頑固な）偏見と」 ,シッドは回想した。「あらゆる種類の社会的な抑圧に加え，我々は皆，頑固な無知や偏見と闘わなければならなかった」   
308,44,“That corrupt politician is to be appointed cabinet minister.” “This appointment is likely to give rise to a fierce controversy among the general public.” ,「あの汚職を働く政治家は任命されることになっている・内閣の大臣に」「この任命は可能性が高い・生み出す・激しい論議を／一般大衆の間で」 ,「あの汚職政治家は閣僚に任命されることになっているのよ」「きっと国民の間で激しい論議が起きるだろうな」   
309,45,I saw him off at the wharf.  I kept waving until he was out of sight. By a strange twist of fate， I was never to see him again. ,私は彼を見送った／波止場で。私は続けた・手を振ることを／次の時まで・彼が見えなくなる（まで）。奇妙な展開によって／運命の／私は二度と彼に会わない運命だった／再び。 ,私は波止場で彼を見送った。私は彼が見えなくなるまで手を振り続けた。奇妙な運命のいたずらによって，その後二度と彼を目にすることはなかった。   
310,45,“I advise you to keep away from them.  I tell you， they are not to be trusted.” “On the contrary， they would be the last people to deceive you.  I have faith in them.” ,「私は勧めます・あなたが・離れていることを・彼らから。言っておくけど／彼らは信用されるべきではない」「それとは反対で／彼らは最後の人々だろう／人をだます（ところの）。私は信用している／彼らを」 ,「彼らには近寄らないほうがいい。いいか，彼らを信用すべきではないんだ」「全く正反対ね。彼らは人をだましたりなんて絶対にしないわよ。私は彼らを信用しているわ」   
311,45,It is absolutely vital to reconcile freedom with basic discipline in raising your child.  If you indulge him too much， you will spoil him. ,それは絶対的に重要だ／調和させることは・自由を／基本的な鍛錬と／育てる中で・自分の子供を。もしあなたが子供を甘やかしたら／過剰に／／あなたはその子をだめにしてしまう。 ,子育てにおいては自由としつけのバランスを取ることが絶対的に重要です。甘やかしすぎると子供をだめにしてしまいます。   
312,45,“I was fed up with school， because if I was conspicuous I was excluded from the activities of my group.” “That's true of our society as a whole.” ,「私は飽き飽きしていた／学校に／何故ならば／もし私が目立ったら／私は除外されたからだ／活動から／私のグループの」「それは当てはまる／我々の社会に／全体としての」 ,「私は学校にはうんざりしていました。何故なら，私が目立とうものなら集団から仲間はずれにされたからです」「それは我々の社会全体に当てはまることだね」   
313,45,“I wonder if this painting is a genuine Van Gogh?” “I don't think so.  It's a fake， that's for sure. If it were real， it wouldn't be in an obscure hotel like this.” ,「私は思う・この絵画は本物のヴァン・ゴッホの絵かなあと」「私は思わない・そうだとは。それは偽物だ／そのことは確実だ。仮にそれが本物だとしたら／それは存在しないだろうに／無名のホテルには／このような」 ,「これって本物のヴァン・ゴッホの絵かしら」「そうじゃないと思う。偽物だよ，絶対。本物だったら，こんな名もないホテルには置かれていないよ」
314,45,“If I were you， I would make better use of it，” Betty suggested.  Amy reacted with rage， “Mind your own business.  It has nothing to do with you.” ,「仮に私があなただとしたら／／私は行うでしょう・より上手な活用を・それの」／とベティはほのめかした。エイミーは反応した／憤慨を伴って／「気をつけなさい・自分自身の本分に。それは何の関係もない・あなたとは」 ,「私だったらもっとうまくそれを活用するけど」とベティはほのめかした。エイミーはかっとなって「大きなお世話よ。あなたには関係ないでしょ」と答えた。   
315,45,Matt didn't bother to hide his anger. “If it weren't for the fact that he is senior to me， I'd punch him in the face and pour this coffee on his bald head.” ,マットはわざわざしなかった／隠すことを・自分の怒りを。「仮になかったとしたら・事実が／以下の・彼が上役である・私より／／私は彼にパンチを食らわすだろうに／顔に／そして注ぐだろう・このコーヒーを／彼のはげた頭の上に」 ,マットは怒りを隠そうともしなかった。「あいつが俺の上役だという事実がなければ，顔面にパンチを食らわして，あのはげ頭にこのコーヒーを注いでやるところだ」   
316,46,The last train was due in 20 minutes and I made it to the station just in time to catch it.  If I had missed it， I would have had to take a taxi home.  ,最終の電車は到着予定だった／20分後に／そして私は到着した／駅へ／かろうじて間に合って／それに乗るのに。仮に私がそれに乗り遅れていたとしたら／／私は乗らなければならなかったであろう・タクシーに／自宅まで。 ,終電は20分後に到着の予定だったが，私はかろうじてそれに間に合い乗ることができた。もし乗り遅れていたら，タクシーで家まで帰らねばならないところだった。 
317,46,The vice president said， “If it hadn't been for that extraordinary PC boom， we couldn't have expanded our modest enterprise into a multimedia giant.” ,副社長は言った／「もしなかったとしたら・あのすさまじいパソコンブームが／／我々は拡大することができなかったであろう・我々の並の企業を／マルチメディアの大企業に」 ,副社長は言った。「あの異常なまでのパソコンブームがなければ，我々は並の企業をマルチメディアの大企業へと発展させることはできなかったでしょうね」 
318,46,“If he had consulted a better specialist， he would still be alive.” “What do you say to charging him with malpractice?” “He would never acknowledge it.” ,「もし（過去に）彼が診てもらっていたら・もっとよい専門医に／／彼は（今）まだ生存しているであろうに」「どう思う？／ その医者を訴えることに対して／医療過誤で」「（そんなことをしても）彼は決してそれを認めないであろう」 ,「もっと良い専門医に診てもらっていれば，彼は今でも生きていたと思います」「その医師を医療過誤で訴えたらどう？」「ミスを認めるなんてことは絶対にしませんよ」   
319,46,The literary critic remarked， “If I were asked how I felt when I happened to read his novel， I could compare it to love at first sight.” ,その文学の評論家は言った／「仮に私が尋ねられたら／どう私が感じたかを／次の時・私が偶然読んだ（時）・彼の小説を／／私はそれをたとえることができよう／恋愛に／初見での」 ,その文学評論家は言った。「たまたま彼の小説を読んだ時どう思ったのかと聞かれれば，それは恋愛の一目惚れにたとえることができますね」   
320,46,We ought not to tolerate excessive packaging. If we were to put an end to this wasteful practice， we would be able to reduce both cost and garbage. ,我々は許容すべきでない・過剰な包装行為を。仮に我々が終わりをもたらしたとしたら・この無駄な習慣的行為に／／我々は減らすことができるだろう・両方を・コストとゴミの。 ,我々は過剰包装を許容すべきではありません。もしこの無駄な行為をやめたとしたら，我々はコストとゴミの両方を減らすことができるのです。   
321,46,We had to undergo a major transformation， during which scores of people were laid off， but without such a restructuring effort， we couldn't have survived. ,私達は経験しなければならなかった・大きな変化を／ちなみにそれ（＝大きな変化）の期間中に・非常に多くの人々が解雇されたが／／しかし／そのようなリストラの努力がなかったら／我々は生き延びることはできなかったでしょう。 ,我々は大きな変革を迫られ，その間に多数の人々が解雇されました。しかしそうしたリストラの努力がなければ我々は生き延びることができなかったでしょう。   
322,46,I cautioned him， “It would be imprudent， not to say foolish， to rely on your instincts and intuition all the time. You ought to use your common sense.” ,私は彼に注意した／「それは賢明ではないだろう／愚かだとは言わないが／頼るとすれば・自分の本能や直感に／いつでも。君は使うべきなのだ・常識的な判断力を」 ,私は彼に注意した。「いつでも本能や直感だけに頼るのであれば，それは愚かだとは言わないまでも賢明なことではない。良識を働かせるべきだ」   
323,47,The economist warned， “A partial treatment for the serious but stable condition would do the economy more harm than good.” ,その経済学者は警告した／「部分的な治療は／深刻だが安定した状態への／もたらすであろう・経済に・（より）多くの害を／利益よりも」 ,その経済学者は「深刻ではあるが安定している状態に対して，部分的な処置を施せば，経済にとってはプラスよりむしろより多くの害を及ぼすことになるだろう」と警告した。   
324,47,Not knowing the appropriate manners for the formal occasion， I felt so embarrassed that I could have sunk into the floor. ,知らずに・適切な作法を／その格式的な行事の／／私は感じた・とても恥ずかしいと／次のほど・私が沈むことができたであろうほど／床の中へと。 ,その格式的な行事において正しい作法がわからず，私は穴があったら入りたいぐらい恥ずかしかった。   
325,47,Now and then， the would-be painter sighs and wishes he were endowed with an artistic talent for painting masterpieces like Renoir's. ,時々／その画家志望者はため息をつく／そして思う／自分に授けられていればなあと／芸術的な才能が／描くための・傑作を／ルノアール（の傑作）のような。 ,その画家志望者は時々ため息をつき，自分にルノワールの傑作が描けるような芸術的才能があればなあと思う。   
326,47,“I wish I hadn't lost my temper and said such a nasty thing to her，” Don lamented， “I wish she would forgive me.” ,「私は思う／私がかっとならなければよかったと／そして言わなければよかったと・あんなひどいことを／彼女に」／とドンは嘆いた／「私は願う／彼女が私を許してくれたらなあと」 ,「ああ，短気を起こして彼女にあんなひどいことを言うんじゃなかったよ」 とドンは嘆いた。「僕のことを許してくれればいいのだけど」   
327,47,“Would it be all right if I used your mobile phone?” “By all means.  Let's see ... There it is.  It's in the right-hand corner， next to the TV set.” ,「それは差し支えないでしょうか／もし私が使ったとしたら・あなたの携帯電話を」「是非どうぞ。えーっと...あそこにそれはある。それはあります／右手の隅に／テレビの隣りに」 ,「携帯電話を使わせてもらっていいですか？」「どうぞどうぞ。えーっと...あっ，あそこです。右手の隅のテレビの隣にあります」  
328,47,The note said， “I'd be grateful if you would promptly deliver the commodities listed below， along with the usual goods.” ,そのメモは述べていた／「私はありがたいのですが／もしあなたに迅速に配達してもらえれば・商品を／一覧表にされたところの・下記に／共に・いつもの商品と（共に）」 ,そのメモには「いつもの商品と一緒に，下記にリストアップした商品を至急送ってもらえるとありがたいです」と書いてあった。   
329,47,“I wonder if you could help me with my homework? I'm really stuck. No matter how I read it， this paragraph doesn't seem to make sense.” ,「私は思う・あなたが私を助けることができるだろうかと／私の宿題を。私は本当に行き詰まっている。関係なく／どのようにして私がそれを読むかに／／この段落は思えない・意味をなしていると」 ,「この宿題を手伝っていただいていいでしょうか。全くお手上げなんです。どう読んでも，この段落が意味をなさないように思えるんです」   
330,48,“Do you mind if I smoke?” I asked. She cleared her throat and replied， “I'd rather you didn't.  Honestly， I have an allergy to cigarette smoke.” ,「あなたは気に障りますか／もし私がタバコを吸ったら」／と私は尋ねた。彼女は取り除いた・喉（のつっかえを）／そして答えた／「私はどちらかというと望む／あなたがそうしないことを。正直に言って／私は持っている・アレルギーを／タバコの煙に対して」 ,「タバコを吸ってもかまいませんか？」と私は尋ねた。彼女は咳払いをして答えた。「できれば吸わないでいただきたいです。正直，たばこの煙にはアレルギーがありまして」   
331,48,She looked as if she were about to burst into tears， when all at once she burst out laughing as though she had gone mad. ,彼女は様子だった／まるで彼女が寸前であるかのような・どっと泣き出す／するとその時／突然／彼女はどっと笑い出した／まるで彼女がなってしまったかのように・頭がおかしく。 ,どっと笑い出した／まるで彼女がなってしまったかのように・頭がおかしく。彼女は今にも泣き出しそうな表情をしていたかと思うと，突然気が狂ったかのように笑い出した。   
332,48,It was a decade before the superpower got over the shock of losing the war， and it took even longer for the psychological scars to heal. ,時間は10年だった／次の以前に・その超大国が乗り越える・ショックを／負けたことの・その戦争に／そして／それは必要とした・さらにより長い時間を／心理的な傷跡が／治ることは。 ,その超大国が敗戦のショックから立ち直るまでには10年かかった。そしてその精神的な傷跡が癒えるまでにはさらに長い年月がかかった。   
333,48,It has been ten years since we set about extending this road to the city center， but as it is， it will probably be another two years before we complete it. ,時間は今までで10年である／次の時以来・私達が取りかかった（時以来）・拡張することに・この道路を／街の中心部まで／しかし／現状では／時間はおそらくさらにあと２年だろう／次の以前には・我々がそれを完成する（以前には）。 ,この道路を街の中心部まで拡張する工事を始めて10年が経ちますが，現状では完成までにおそらくあと2年かかるでしょう。   
334,48,He proclaimed， “Terrorism is a great threat to world peace.  It is time the international community cooperated in eliminating it once and for all.” ,彼は宣言した／「テロ行為は大きな脅威である／世界平和にとって。今は時である／（すなわちその時に）国際的な共同体が協力を行う／それを廃絶することにおいて／これを限りに」 ,彼は宣言した。「テロは世界平和を脅かす大きな脅威です。今こそ国際社会が一致協力し，これを限りにテロを撲滅すべきなのです」   
335,48,In spite of her annoyance， Miss Ford scolded the mischievous pupil mildly by saying， “It is high time you learned to tell right from wrong.” ,かかわらず・自分のいらだち（にも）／フォード先生は叱った・そのいたずら好きな児童を／穏やかに／言うことによって／「今はもう潮時である／（すなわちその時に）君が身につける／見分けることを・正しいことを・間違ったことから（区別して）」 ,フォード先生はいらだっていたが，そのいたずらっ子の児童を優しく叱った。「君もそろそろ正しいことと間違ったことの区別ができるようにならないとね」   
336,48,Financial institutions invested heavily in property. With land prices soaring， it was extremely difficult to resist the temptation of easy profits. ,金融の機関は投資した／大量に／土地と建物に。次の状況で・土地の価格が・急上昇している（状況で）／それは極めて難しかった／抵抗することは・誘惑に／たやすい利益（獲得）の。 ,金融機関は土地と建物に多額の投資を行った。土地価格が急上昇する中，濡れ手に粟で利益を得るという誘惑に耐えるのは極めて困難なことだった。   
337,49,The two plants look exactly alike.  Thus it would be all but impossible for someone other than a botanical expert to distinguish one from the other. ,その２つの植物は見える・まさしく同様に。それ故に／それはほとんど不可能であろう／誰かが／植物学の専門家以外の／区別することは・片方を／もう一方から（分けて）。 ,その２つの植物の外見はそっくりである。よって植物学の専門家でもない限り両者を見分けるのはほとんど不可能だろう。   
338,49,“It was so thoughtful of you to send me the money. You saved my life.  I'm much obliged.” “Don't mention it.  It was the least I could do.” ,「それはとても思いやりがあった／つまりあなたのことですが／送ることは・私に・そのお金を。あなたは救った・私の命を。私はとても感謝しています」「そんなことを口にしないで下さい。それは最小限のことでした／（すなわちそれを） 私が行うことのできる」 ,「お金を送っていただいて本当にご親切様です。助かりました。とても感謝しております」「礼には及びません。たいしたことはしていませんから」   
339,49,“There is no use wailing about past failures.  It's no use crying over spilt milk.” “You're right.  Let's face up to the harsh reality and make the best of it.” ,「何の役立ちもない／嘆き悲しむことに／過去の失敗について。それは何の役立ちもない／泣くことは／こぼされたミルクに関して」「あなた（の言うこと）は正しい。しっかり受け止めましょう・その厳しい現実を／そしてそれを前向きにとらえましょう」 ,「過去の失敗を嘆いても仕方がない。覆水盆に返らずだ」「その通りですね。厳しい現実だけどしっかりと受け止めて，前向きに頑張りましょう」   
340,49,It was worthwhile my taking the trouble to apply for a local authority grant.  I was awarded as much as $2，000 by the city council. ,それは価値があった／私が取ったことは・手間を／申し込むという／地方当局の助成金を得るために。私は授与された・なんと２千ドルも／市の評議会によって。 ,わざわざ地方助成金の申請を行った甲斐があった。市の評議会から２千ドルものお金がおりたのだ。   
341,49,It was silly of me but I took it for granted that she was content with her life.  It never occurred to me that she would be full of dissatisfaction. ,それは愚かだった／私のことだ／が／私はそれを取っていた・当然のこととして／次のことを・彼女が満足していることを・自分の生活に。それは一度もひらめかなかった・私には／次のことは・彼女がいっぱいであろうということは・不満で。 ,私が愚かだったのですが，私は彼女が自分の生活に満足していると決めつけていました。不満でいっぱいであろうなどとは思いもしなかったのです。   
342,49,It is said that this unique tradition is related to that sacred custom and each dates back to medieval times and ancient times， respectively. ,それが言われている／次のことが・この独特な伝統は関係があると／その神聖な風習に／そしておのおのはその起源をさかのぼると／中世の時代に／そして古代の時代に／それぞれ。 ,この独特な伝統はその神聖な風習とかかわりがあり，前者（＝独特な伝統）は中世に，後者（＝神聖な風習）は古代に，それぞれ起源をさかのぼると言われている。 
343,49,“No wonder the negotiation broke down!  To begin with， our representatives are not good at bargaining with tough negotiators.” ,「（それは）何の不思議もない／その交渉が決裂したことは。まず第一に／我々の代表者達はうまくない・交渉することが／手強い交渉者達と」 ,「交渉が決裂したのは何ら不思議ではない。そもそも，我々の代表者はタフな交渉相手との取引がうまくないのだ」   
344,50,We have it from a reliable source that， owing to a long drought and famine， the isolated country is in need of outside support， including food aid.  ,私達はそれを聞いている／信頼できる情報源から／次のことを／原因で・長い日照りと飢饉が／その孤立した国は必要な状態にあると・外部の援助が／含む・食料援助を。 ,信頼すべき筋からの情報によれば，長い日照りと飢饉によってその孤立した国は食料援助を含む外部からの支援が必要だとのことです。   
345,50,Conventional wisdom has it that labor productivity rises in proportion to incentives offered， such as bonus payments and speedy promotion. ,一般的に受け入れられている考え方はそれをもっている／以下のことを・労働生産性は上昇する／比例して／刺激に・差し出されるところの／例えば（以下のような）・ボーナスの支払いや迅速な昇進（のような）。 ,労働生産性はボーナスや迅速な昇進といった刺激（インセンティブ）に比例して上昇する，というのが一般的な考え方だそうです。   
