176,26,“Don't quote me on this， but judging from his speech at the board meeting， the CEO's disposition is not optimistic; it is， if anything， on the pessimistic side.” ,「私（の言葉）を引用しないで下さい／これに関して／ですが／判断すると／彼のスピーチから／重役会議での／最高経営責任者の気質は楽天的ではない／／それはある／どちらかと言えば／悲観的な側に」 ,「これを私の弁として引用しないでくれよ。重役会議でのスピーチから判断するとだね，最高経営責任者の性格は楽観的ではなく，どちらかと言えば悲観的だよ」  
177,26,The sales figures in the third quarter were fairly good， but considering the market growth， there was still plenty of room for improvement.  ,売り上げの数字は／第三四半期における／まずまず良かった／しかし／考慮に入れれば・市場の成長を／あった・まだたくさんの余地が／改善の。 ,第三四半期の売り上げはまずまず好調であったが，市場の伸びを考えればまだまだ改善の余地はたっぷりあった。   
178,26,Having withdrawn most of his savings from his bank deposit， the wealthy landowner had a considerable amount of money at his disposal. ,すでに引き出し終えていて・大半を／彼の貯金の／自分の銀行預金から／その裕福な地主は持っていた・かなりの量のお金を／自分が自由に使えるところの。 ,その裕福な地主は銀行預金から貯金の大半を引き出していて，自由に使えるお金がかなりたくさんあった。   
179,26,The dedicated coach， having trained the promising runner for the past few years， seems delighted with the steady progress she has made up to now. ,そのひたむきなコーチは／（今まで）ずっと鍛えてきたのだが・その有望なランナーを／過去数年間に渡って／様子である・とても喜んでいる／着実な進歩に／（すなわちそれを）彼女が遂げたのだが／現在までに。 ,その指導熱心なコーチは，過去数年間に渡ってその有望なランナーを指導してきたが，彼女が今日までに遂げた着実な進歩にとても喜んでいる様子だ。
180,26,Never having treated a wounded soldier， the male nurse passed out at the sight of one covered with blood and didn't recover consciousness for a while. ,一度も治療した経験がなく・けがを負わされた兵士を／その男性の看護士は気絶した／見て・一人（の兵士）を／覆われた・血で／そして意識が戻らなかった／しばらくの間。 ,負傷した兵士を治療したことが一度もなく，その男性看護士は血まみれになった兵士を見ると気を失い，しばらく意識が戻らなかった。   
181,26,True to his word， the athletic genius performed an astonishing feat with ease; he broke three world records by wide margins. ,忠実に・自分の約束に対し／その運動競技の天才は果たした・人を驚かせるような偉業を／たやすく／／彼は破った・三つの世界記録を／幅広い格差で。 ,公言通り，その天才競技者は楽々と驚くべき偉業を成し遂げた。彼は三つの世界記録を大差をつけて破ったのである。   
182,26,Frantic with worry， he told the cruel kidnapper that he was prepared to pay any ransom provided that the release of his loved ones was assured. ,気も狂わんばかりで／心配を伴い／彼は言った・その残酷な誘拐犯に／次のことを・自分は用意があると／支払う・いかなる（額の）身代金も／条件ならば／次のことが・釈放が／自分の愛する家族の／保証されるという。 ,彼は心配で気も狂わんばかりになり，残酷な誘拐犯に対して，愛する家族の釈放が保証されるのであれば身代金はいくらでも支払う準備があると言った。    
183,27,Unable to suppress his feelings， he exclaimed， “How rotten he is!  I would rather go without food and drink than borrow money from that sly old devil.” ,できずに・抑えることが・自分の感情を／彼は大きな声を出した／「なんて最低なのか／彼は。私はむしろ過ごしたい・食べ物と飲み物なしに／借りるよりは・金を／あのずる賢い老いぼれ野郎から」 ,感情を抑えきれず，彼は声を荒げた。「なんという最低な奴。あんなずる賢い老いぼれから金を借りるくらいなら飲まず食わずでいた方がまだましだ」
184,27,Dot was standing in the corner with her arms folded  and her eyes closed.  With no one paying any attention to her， she felt lonely and out of place. ,ドットは立っていた／隅に／次の状態で・彼女の腕が組まれ，そして彼女の目が閉じられた（状態で）。次の状態で・誰も払っていない・いかなる注意も／彼女に／彼女は感じていた・孤独だとそして場違いだと。 ,ドットは腕組みをし，目を閉じて部屋の隅に立っていた。誰からも見向きもされず，孤独感と疎外感を味わっていた。   
185,27,With opening night just around the corner， twenty-odd members of staff were busy assembling the stage equipment. ,次の状態で・初公演の夜がまさにすぐそこまで迫っている（状態で）／20余りの構成員達が／スタッフの／忙しくしていた／組み立てながら・舞台装置を。 ,初公演の夜を間近に控え，20数名のスタッフが忙しく舞台装置を組み立てていた。 
186,27,Eyes wide open， the curious boy kept gazing at a cricket as it stopped chirping， made its way to the puddle， and leaped over it. ,（次の状態で）目が広く開いている／その好奇心旺盛な男の子は続けた・見つめることを／コオロギを／／以下と同時並行で・それがやめるのと・鳴くことを／そして進むのと／水たまりまで／そして飛び跳ねるのと／それを越えて。 ,好奇心旺盛なその男の子は，一匹のコオロギが鳴くのをやめ，水たまりまで進み，そしてぴょんと飛び越える様子を目をまんまると開けて見ていた。   
187,27,The latest statistics show that the number of crimes in the urban districts of this country， far from decreasing， is on the increase again. ,最新の統計は示している／次のことを・数は／犯罪の／都市部の区域における／この国の／減少するどころか／上昇中であると／再び。 ,最新の統計によると，この国の都市部の犯罪件数は減少するどころか再び増加を続けている。   
188,27,All but a few of them doubted that the bold and daring explorers could overcome the formidable obstacles and conduct a successful expedition to the Antarctic. ,全てが／少数を除き／彼等の中の／疑っていた／次のことを・その大胆で危険を顧みない探検家達が乗り越えることができるということを・その非常に困難な障害を／そして行うことができるということを・成功した探検の旅を／南極地方への。 ,彼らのほぼ全員が，大胆で恐れを知らないその探検家達が非常に困難な障害を乗り越えて南極地方への探検旅行に成功するだろうとは思っていなかった。   
189,27,“I can tell from this score that he is continuing to make an effort to improve his English.” “I suspect he either cheated or got the score by accident.” ,「私はわかる／この点数から／次のことが・彼が続けていることが／行うことを・努力を／高めるための・自分の英語を」「私は疑っている／彼は不正をしたのではないかと／さもなくば取ったのではないかと・その点数を／偶然に」 ,「この点数を見れば，彼が英語上達のために継続的な努力をしていることがわかるね」「カンニングをしたか，まぐれでその点を取ったかのどっちかだと思いますけど」   
190,28,It was so brightly colored that I didn't feel comfortable. I recommended he change it to create a quieter atmosphere to suit the taste of elderly people. ,それはとても明るく色が付けられていた／次のほど・私が感じなかったほど・心地よいと。私は勧めた／彼がそれを変えるように／作り出すために・より落ち着いた雰囲気を／合うようにするために・好みに／年輩の人々の。 ,私にとってそれはくつろげないほど派手な色だった。私は彼に，年輩者の好みに合うよう，色を変えてもっと落ち着いた雰囲気にしたらどうかと言った。   
191,28,The annual study released Wednesday requested that far more resources be devoted to the care of needy refugees to ease their distress. ,年に一度の調査は／発表されたところの／水曜日に／要請していた／次のことを・はるかにより多くの資金が注がれるよう／世話に／困窮した難民達の／和らげるために・彼らの苦痛を。 ,水曜日に公表された年次調査書は，困窮する難民の保護にもっと多くの資金を割り当て，彼らの苦痛を和らげるよう求めていた。   
192,28,A good many city dwellers were frustrated that they couldn't afford to rent a decent apartment in central Tokyo， let alone own a house. ,非常に多くの都市住人は不満であった／次のことに・自分達に余裕がないことに／借りる・まともなアパートを／中心部の東京で／言うに及ばず・所有することは・一軒の家を。 ,非常に多くの都市住人が，東京の中心部において一軒家を所有するのはもちろんのこと，まともなアパートすら借りられないことに不満を覚えていた。
193,28,I am bitterly disappointed and shocked that a majority of the delegates didn't vote for the bill to protect endangered species from extinction. ,私はひどく落胆しショックを受けている／次のことに・過半数が／代議員達の／賛成票を投じなかったことに・その法案に／守るための・絶滅の危機にさらされた種を／絶滅から。 ,絶滅危惧種を絶滅の危機から守るための法案に，代議員の過半数が賛成票を投じなかったことに，私は大きな落胆とショックを感じています。   
194,28,The trouble with the peasants toiling in those barren fields was that they were not familiar with the basic concept of irrigation. ,困ったことは／小作農達に関しての／苦労して働いているところの／それらの不毛の畑で／次のことだった・彼らがよく知らない・基本的な概念を／灌漑の。 ,困ったことに，それらの不毛な畑であくせく働いている小作農達は，灌漑の基本概念がよくわかっていなかった。   
195,28,“The fact is， I'm not on good terms with Debbie. I run into her once in a while on campus， but we seldom exchange greetings.” ,「事実は（というと）／私は良好な間柄ではない／デビーと。私は彼女と出くわす／時々／キャンパスで／しかし／私達はめったに交わさない・挨拶を」 ,「実は私，デビーとは親しい間柄ではないんです。時々キャンパスで顔を合わせますが，お互い挨拶を交わすことはほとんどありません」   
196,28,“With regard to your recent inquiry， I'm pleased to inform you that the other party has finally agreed to settle out of court.” ,「関連して・あなたの最近の問い合わせに／私は嬉しい／知らせて・あなたに／次のことを・相手側がついに合意したことを／決着をつけることに／法廷外で」 ,「先だってのお問い合わせの件でございますが，先方がようやく示談に合意されたということを喜びと共にご報告させて頂きます」  
197,29,The president told the assembly of diligent workers that he took great pride in them and that， in the long run， their efforts would be amply rewarded.  ,社長は言った・集団に／勤勉な労働者達の／次のことを・自分は抱いていると・大きな誇りを・彼らに／そしてまた／次のことを／長期的には／彼らの努力が（将来）十分に報われると。 ,社長は勤勉な労働者達に対し，彼らのことをとても誇りに思っており，彼らの努力は長期的には十分報われることになるだろうと語った。   
198,29,The accountant ordered his assistant to look over the figures in the books to see if there were any obvious errors or missing items. ,その会計士は命じた・自分の助手に・ざっと調べるように・数字を／会計簿の／確かめるために／あるかどうかを・何か明らかな間違いやもしくは欠けている項目が。 ,その会計士は，明らかな間違いや欠落している項目がないか帳簿の数字をざっと調べるよう助手に命じた。   
199,29,All of a sudden I became uncertain as to whether or not I had chosen the right clothes and canceled the order， but I was charged a cancellation fee. ,突然／私はなった・確信がない状態に／以下に関して／私が選んだのか否かに・最適な服を／そして取り消した・その注文を／しかし／私は請求された・取り消し料金を。 ,選んだ服の選択が正しかったのかどうか急に不安になり注文を取り消したが，それに対してキャンセル料を請求された。  
200,29,“Have you checked the instrument panel?” “Yes， but I can't figure out what's wrong.  Maybe it's an electrical failure.” “Operate it manually.” ,「すでに君はチェックし終えているか・計器盤を」「はい／しかし／私はわかりません／何がおかしいのか。たぶん／それは電気系統の停止です」「それを操作しろ／手動で」 ,「計器は調べたか？」「はい。しかしどこに問題があるのかわかりません。おそらく電気系統の停止だと思いますが」「手動で操作しろ」   
201,29,A few passengers intervened between a streetcar driver and a cab driver quarreling over who was to blame for a minor collision. ,少数の乗客が仲裁に入った／間に・路面電車の運転手とタクシー運転手との／口論をしているところの／次のことをめぐって／どちらに責任があるのか／ある深刻でない衝突に対し。 ,接触事故の責任をめぐって路面電車の運転士とタクシー運転手が口論しているところに数人の乗客が仲裁に入った。   
202,29,Information technologies， known as IT， are advancing so rapidly that ordinary people have no idea what it will be like five years from now. ,情報技術は／知られているが・ＩＴとして／進歩している／とても急速に／次のほど・普通の人々がわからない（ほど）／それがどのようになっているか／５年の時点で・今から。 ,一般にＩＴと呼ばれる情報技術は，５年後にそれがどうなっているか一般人には見当もつかないほど日進月歩の進化を遂げている。   
203,29,“What do you think makes them competitive?” “For the most part it's because they spend substantial sums of money on research and development.” ,「何が／あなたは思いますか／させていると・彼らを・競争力があるように」「大部分において／それは／次の理由からです・彼らが費やしている・かなりの額のお金を／研究と開発に」 ,「どうして彼らは競争力があるのだと思う？」「主な理由としては，研究開発に多額の投資をしているということが挙げられます」   
204,30,I went on a trip to rural Iran.  The landscape was beautiful beyond comparison.  What made the scenery second to none were the paddy fields. ,私は行った・旅行に／いなかのイランへ。そこの風景は美しかった／（他と）比較できないくらいに。させていたものは・その風景を・何にも引けを取らないように／水田であった。 ,私はイランの片田舎へ旅をした。そこの景色は比べるものがないほど美しかった。風景を比類なきものにしていたのは水田であった。   
205,30,As a matter of fact， what you described as Chinese characteristics apply not only to the Chinese but also other Asian peoples. ,実際のところ／ことは・あなたが述べた（こと）／中国人の特徴として／当てはまる／ただ中国国民に対してだけでなく／また他のアジアの国民にも。 ,実際のところ，あなたが中国人の特徴だとおっしゃったことは単に中国人だけでなくアジアの他の国民にも当てはまることです。   
206,30,“There he goes again， trying to impress others with what he calls his extensive knowledge of oriental cuisine!” “He really loves to show off.” ,「彼のいつものが始まった／しようとしている／感心させることを・他人を／もので・彼が呼んでいる・幅広い知識と／東洋の料理の」「彼は本当に大好きだ／自分を誇示するのが」 ,「また彼のいつもの癖が始まったわね。東洋料理についての博学ぶりで人を感心させようとしているのよ」「あいつは人前で格好つけるのが本当に好きな奴だよ」   
207,30,After being presented with the award， the director expressed his gratitude. “I owe what I am today to my wonderful staff.  I can't thank them enough.” ,後に・贈呈された（後に）／その賞を／その映画監督は表現した・自分の感謝の気持ちを。「私はおかげだと思う／私の存在が・今日の／私のすばらしいスタッフの。私には彼らに感謝することができない／十分には」 ,受賞後，その映画監督は感謝の意を表した。「今日私があるのは，すばらしいスタッフのおかげです。彼らには感謝のしようもありません」 
208,30,When the misery of dying children was broadcast， I was filled with so much sympathy that I decided to donate what little money I had to charity. ,次の時に・惨状が／死にかけている子供達の／放送された（時に）／／私は満たされた／非常に多くの同情で／次のほど・私が決めた（ほど）／寄付することを・どんなに少ないお金でも・私がもっていた／慈善基金へ。 ,瀕死の子供達の惨状が放送された時，私はふびんな気持ちでいっぱいになり，なけなしのお金を慈善基金に寄付しようと決めた。   
209,30,“Do you realize this is a particularly crucial moment?” inquired the Secretary of State. “Whatever we do now will determine the destiny of this administration.” ,「君たちは認識しているのか／今が特に極めて重要な時であることを」／と尋ねた・国務長官が。「何であれ我々が今行うことは（全て）／決定することになる・運命を／この政権の」 ,「今が極めて重要な時期だという認識が君たちにはあるのかね」と国務長官は尋ねた。「今我々の取る行動がこの政権の命運を決めることになるのだよ」   
210,30,The vigorous old man said， “I welcome whoever wishes to come， so do bring as many pals as you can -- the more， the merrier.”,その活発な老人は言った／「私は歓迎する／誰でも（全て）望む者は・来ることを／だから／是非とも連れてきなさい・同じだけの数の友人を／君が（連れてくることが）できるのと。多ければ多いほど／それだけより楽しい」,活発な老人は言った。「来たいというなら誰でも歓迎だ。できるだけたくさん友達を連れておいで。多ければ多いほど楽しいからね」 
211,31,Kyoto， the ancient capital famous for its old temples and shrines， lies to the north of Osaka and some 500 kilometers to the west of Tokyo. ,京都は／つまり古代の首都であるが／有名な／理由で・その古い寺院と神社が（理由で）／ある／北の方に／大阪の／そして約500キロの所に／西の方に／東京の。 ,京都は古い神社や仏閣で有名な古都ですが，大阪の北にあり，東京からおよそ500キロ西に位置します。   
212,31,The economics textbook says inflation， that is， a general rise in the prices of goods and services， results from an excess of demand over supply. ,経済学の教科書は書いている／（以下のことを）インフレは／それはつまり全体的な上昇のことだが／価格の／商品やサービスの／結果である・過剰から生じる／需要の／供給を上回る。 ,経済学の教科書によると，インフレ，つまり商品とサービスの価格の全般的な上昇は，供給に対して需要が過剰になった場合に生じるということだ。   
213,31,The thesis covered all phases of the glories and triumphs of civilization and omitted a less prominent factor， i.e. the psychology of the masses. ,その論文はカバーしていた・全ての局面を／栄華と功績の／文明の／そして省いていた・それより目立たない要素を／つまり心理を／大衆の。 ,その論文は文明の栄華と功績の全ての局面を取り上げ，それほど目立たない要素である大衆の心理は取り上げていなかった。   
214,31,All living creatures depend for their existence on the chemical elements of oxygen and hydrogen. In a word， they can't exist without water. ,全ての生きている物は依存している／自己の生存のために／化学的な構成要素に／酸素と水素という。手短に言えば／生物は存在できない／水なしには。 ,全ての生き物は酸素と水素という化学元素にその生命を依存しています。要するに生物は水なしには生存できないということです。   
215,31,Astronomers are convinced of the theory that the universe came into being and evolved as a result of a massive explosion.,天文学者達は（正しいと）確信している／理論を／つまり次のこと（＝内容）だが・宇宙は生まれた／そして発達した／結果として／巨大な爆発の。 ,天文学者は宇宙が巨大な爆発の結果生まれそして発達したという理論を確信している。   
216,31,The clergyman was barred from addressing the political rally on the grounds that he might add fuel to revolutionary sentiments and start a revolt. ,その聖職者は妨げられた／演説をすることから・その政治的な集会で／理由にもとづいて／つまり以下のことだが・彼が付け足すかもしれないという・「燃料」を／革命の感情に／そして引き起こす（かもしれないという）・暴動を。 ,その聖職者は，革命感情に油を注ぎ民衆蜂起を引き起こす可能性があるという理由から，政治集会での演説を阻止された。   
217,31,Medical scientists came to more or less the same conclusion that a certain virus， by destroying specific cells， brings about the rare， fatal disease. ,医学の科学者達は達した・大なり小なり同じ結論に／つまりそれは以下の内容だ・あるウイルスが／破壊することにより・特定の細胞を／引き起こすという・その珍しい致命的な病気を。 ,医学者達は，ある種のウイルスが特定の細胞を破壊してその不治の奇病を引き起こすという考えでほぼ一致した。   
218,32,The immense bronze statue was erected as a memorial to the heroic statesman who sacrificed his life for the sake of democracy. ,その巨大な青銅の像は建てられた／記念碑として／その英雄の政治家への／すなわちその人は犠牲にした・自分の命を／民主主義のために。 ,民主主義のために自らの命を犠牲にした英雄の政治家を記念して，巨大なブロンズ像が建てられた。   
219,32,I'm deeply concerned about millions of potential addicts who are not in the least aware of the grave dangers of drug and alcohol abuse. ,私は非常に心配している／以下について・非常に多くの潜在的な中毒者に（ついて）／すなわちその人達は少しも気づいていない／重大な危険性に／麻薬とアルコールの濫用の。 ,麻薬やアルコールの濫用がもたらす重大な危険性に全く気づいていない非常に多くの中毒予備軍に対して，私は大きな懸念を抱いています。   
